<?xml version="1.0" encoding="UTF-8"?>
<xs:schema xmlns:xs="http://www.w3.org/2001/XMLSchema" xmlns:element="http://webmill.riverock.org/xsd/riverock-template-page-elements.xsd" xmlns:jaxb="http://java.sun.com/xml/ns/jaxb" xmlns:portal="http://webmill.riverock.org/xsd/riverock-template-elements.xsd" elementFormDefault="qualified" attributeFormDefault="unqualified" jaxb:version="2.0">
	<xs:import namespace="http://www.w3.org/XML/1998/namespace" schemaLocation="xml.xsd"/>
	<xs:import namespace="http://webmill.riverock.org/xsd/riverock-template-page-elements.xsd" schemaLocation="riverock-template-page-elements.xsd"/>
	<xs:element name="SiteTemplate" type="SiteTemplate"/>
	<xs:complexType name="SiteTemplate">
		<xs:choice>
			<xs:element name="SiteTemplateItem" type="SiteTemplateItem" maxOccurs="unbounded">
				<xs:annotation>
					<xs:documentation>@deprecated use only XHTML markup</xs:documentation>
				</xs:annotation>
			</xs:element>
		</xs:choice>
		<xs:attribute name="role" type="xs:string" use="optional"/>
		<xs:attribute name="language" type="xs:string" use="optional"/>
		<xs:attribute name="type" type="xs:string" use="optional"/>
	</xs:complexType>
	<xs:complexType name="SiteTemplateItem">
		<xs:sequence>
			<xs:element name="Parameter" type="Parameter" minOccurs="0" maxOccurs="unbounded"/>
		</xs:sequence>
		<xs:attribute name="type" use="required">
			<xs:simpleType>
				<xs:restriction base="xs:string">
					<xs:enumeration value="portlet"/>
					<xs:enumeration value="custom"/>
					<xs:enumeration value="file"/>
					<xs:enumeration value="dynamic"/>
				</xs:restriction>
			</xs:simpleType>
		</xs:attribute>
		<xs:attribute name="value" type="xs:string"/>
		<xs:attribute name="code" type="xs:string"/>
		<xs:attribute name="xmlRoot" type="xs:string"/>
		<xs:attribute name="role" type="xs:string"/>
		<xs:attribute name="template" type="xs:string"/>
	</xs:complexType>
	<xs:complexType name="Parameter">
		<xs:attribute name="name" type="xs:string" use="required"/>
		<xs:attribute name="value" type="xs:string" use="required"/>
	</xs:complexType>
	<xs:element name="Template">
		<xs:complexType>
			<xs:choice maxOccurs="unbounded">
				<xs:element ref="element:dynamic"/>
				<xs:element ref="element:portlet"/>
				<xs:element ref="element:xslt"/>
				<xs:element ref="element:include"/>
			</xs:choice>
		</xs:complexType>
	</xs:element>
</xs:schema>
