<?xml version="1.0" encoding="UTF-8"?>
<!-- edited with XMLSpy v2005 rel. 3 U (http://www.altova.com) by Serg (Ru-Board) -->
<!DOCTYPE SiteTemplate SYSTEM "http://www.w3.org/TR/xhtml1/DTD/xhtml1-strict.dtd">
<SiteTemplate role="test.role" xmlns:portal="http://webmill.riverock.org/xsd/riverock-template-portal-items" xmlns:xsi="http://www.w3.org/2001/XMLSchema-instance" xsi:noNamespaceSchemaLocation="C:\sandbox\riverock\trunk\riverock-webmill\src\main\xsd\riverock-template.xsd">
	<SiteTemplateItem type="custom" value="HeaderStart"/>
	<SiteTemplateItem type="custom" value="HeaderText"/>
	<SiteTemplateItem type="custom" value="HeaderEnd"/>
	<SiteTemplateItem type="portlet" value="mill.menu" code="TOP_MENU" xmlRoot="TopMenu" role="webmill.authentic"/>
	<SiteTemplateItem type="portlet" value="mill.login_xml" xmlRoot="LoginOnIndexPage"/>
	<SiteTemplateItem type="custom" value="MainStart"/>
	<SiteTemplateItem type="portlet" value="mill.menu"/>
	<SiteTemplateItem type="portlet" value="mill.menu_member"/>
	<SiteTemplateItem type="custom" value="Separator"/>
	<SiteTemplateItem type="portlet" value="mill.news_block"/>
	<SiteTemplateItem type="portlet" value="mill.menu" code="DEFAULT_ru_RU">
		<Parameter name="level" value="1"/>
		<Parameter name="type_level" value="equal"/>
	</SiteTemplateItem>
	<SiteTemplateItem type="portlet" value="mill.menu" code="DEFAULT_ru_RU">
		<Parameter name="level" value="1"/>
		<Parameter name="type_level" value="great"/>
	</SiteTemplateItem>
	<SiteTemplateItem type="custom" value="Footer"/>
</SiteTemplate>
